field_order,field_type,field_id,label,description,data_source,required,placeholder,options_type,default_value
1,markdown,header,,## Add/Modify: Arrangement\n\nGrid staggering arrangement (e.g. Arakawa grids).,none,false,,,
2,input,validation_key,Validation Key,Unique identifier (lowercase with hyphens),none,true,e.g. arakawa-c,,
3,input,ui_label,UI Label,Display name,none,false,e.g. Arakawa C-grid,,
4,textarea,description,Description,Detailed description of the arrangement,none,false,,,
5,dropdown,issue_kind,Issue Kind,New or modify existing,issue_kind,true,,list,0
6,input,collaborators,Additional Collaborators,To add attribution to additional members include their GitHub usernames (only) separated by a comma.,none,false,e.g. user1, user2, user3
